{
  "assemblyId": "solitaire",
  "requiredComponents": ["band", "stone_reference", "prongs", "basket_support"],
  "optionalComponents": [],
  "components": [],
  "assemblyMetadata": {
    "definitionHash": "355ddca57e7e49ad",
    "generatorVersion": "0.1.0",
    "generationDurationS": 0.730515600182116
  },
  "transformOwnership": "PLANNED — see docs/bible/07-atlas/125-transformations.md",
  "aggregateBoundingBox": {
    "xmin": -10.7000001, "xmax": 10.7000001,
    "ymin": -3.635, "ymax": 3.635,
    "zmin": -10.7000001, "zmax": 15.6000001
  },
  "totalProductionMetalVolume": 341.44334316909976,
  "componentCount": 4,
  "generationStatus": "SUCCEEDED",
  "warnings": []
}
